{
  "schemaVersion": "1.0",
  "storyId": "S1",
  "phase": "requirement",
  "runtime": {
    "runId": "S1",
    "workflow": ".harness/workflows/e2e-development.yaml",
    "status": "template",
    "revision": 0,
    "previousPhase": null,
    "blocked": null,
    "records": [],
    "createdAt": null,
    "updatedAt": null
  },
  "requirement": {
    "summary": "",
    "openQuestions": [],
    "acceptanceCriteria": []
  },
  "knowledge": {
    "loadedFiles": [],
    "staleFiles": [],
    "missingAreas": []
  },
  "tasks": [],
  "dag": {
    "nodes": [],
    "edges": [],
    "waves": []
  },
  "worktrees": [],
  "tests": {
    "commands": [],
    "results": []
  },
  "review": {
    "findings": [],
    "status": "pending"
  },
  "verification": {
    "cases": [],
    "results": []
  },
  "delivery": {
    "ownedFiles": [],
    "commit": null,
    "pr": null
  },
  "logs": []
}
